[
  {
    "id": "day-01",
    "level": "A1",
    "title": "Доброе утро",
    "text": "I get up early. I open the window and make a cup of tea.",
    "translation": "Я рано встаю. Я открываю окно и готовлю чашку чая.",
    "phrases": [
      {
        "id": "get-up",
        "text": "get up",
        "meaning": "вставать с постели",
        "note": "Get up — именно встать. Wake up — проснуться: можно проснуться, но ещё лежать в кровати.",
        "example": "I usually get up at seven."
      }
    ]
  },
  {
    "id": "day-02",
    "level": "A1",
    "title": "Кофе с собой",
    "text": "I would like a small coffee, please. Can I have it to go?",
    "translation": "Я бы хотел маленький кофе, пожалуйста. Можно с собой?",
    "phrases": [
      {
        "id": "to-go",
        "text": "to go",
        "meaning": "с собой, навынос",
        "note": "Так заказывают еду и напитки навынос, особенно в американском английском. В Британии часто говорят to take away.",
        "example": "Two teas to go, please."
      }
    ]
  },
  {
    "id": "day-03",
    "level": "A2",
    "title": "Без спешки",
    "text": "Every morning, I take my time and enjoy a cup of coffee. It helps me get ready for the day.",
    "translation": "Каждое утро я не спешу и наслаждаюсь чашкой кофе. Это помогает мне подготовиться к новому дню.",
    "phrases": [
      {
        "id": "take-my-time",
        "text": "take my time",
        "meaning": "не спешить, делать в своём темпе",
        "note": "Take your time — мягкое «не торопись». Меняйте притяжательное местоимение: I take my time, she takes her time.",
        "example": "Take your time. We are not in a hurry."
      },
      {
        "id": "get-ready",
        "text": "get ready",
        "meaning": "готовиться, собираться",
        "note": "Get ready for + событие или предмет. Get ready to + действие: get ready to leave — собираться уходить.",
        "example": "We need to get ready for the trip."
      }
    ]
  },
  {
    "id": "day-04",
    "level": "A2",
    "title": "По дороге домой",
    "text": "We have run out of milk. I will pick some up on my way home from work.",
    "translation": "У нас закончилось молоко. Я куплю немного по дороге домой с работы.",
    "phrases": [
      {
        "id": "run-out-of",
        "text": "run out of",
        "meaning": "израсходовать; остаться без чего-либо",
        "note": "Run out of используют с тем, что может закончиться: milk, money, time. Здесь have run out — результат уже есть: молока нет.",
        "example": "We have run out of bread."
      },
      {
        "id": "on-my-way",
        "text": "on my way",
        "meaning": "по пути, по дороге",
        "note": "On my way home — по дороге домой; перед home предлог to не нужен. Но: on my way to work.",
        "example": "I will call you on my way home."
      }
    ]
  },
  {
    "id": "day-05",
    "level": "B1",
    "title": "Освободить вечер",
    "text": "I try to get things done before dinner so that I can switch off and spend the evening with my family.",
    "translation": "Я стараюсь закончить дела до ужина, чтобы отвлечься от забот и провести вечер с семьёй.",
    "phrases": [
      {
        "id": "get-things-done",
        "text": "get things done",
        "meaning": "заканчивать дела, справляться с задачами",
        "note": "Выражение подчёркивает результат. Get something done также может означать организовать выполнение работы другим человеком.",
        "example": "I get things done more easily in the morning."
      },
      {
        "id": "switch-off",
        "text": "switch off",
        "meaning": "отвлечься от работы, расслабиться",
        "note": "Буквально — выключить прибор. О человеке это образно: перестать думать о делах и отдохнуть.",
        "example": "A walk helps me switch off after work."
      }
    ]
  },
  {
    "id": "day-06",
    "level": "B1",
    "title": "Небольшие перемены",
    "text": "I used to check my phone first thing in the morning. These days, I leave it on the shelf and enjoy a quiet breakfast.",
    "translation": "Раньше я проверял телефон первым делом с утра. Теперь я оставляю его на полке и спокойно завтракаю.",
    "phrases": [
      {
        "id": "used-to",
        "text": "used to",
        "meaning": "раньше обычно делал, а теперь уже нет",
        "note": "Used to + начальная форма глагола описывает прошлую привычку. Не путайте с be used to + -ing: быть привыкшим к чему-либо.",
        "example": "I used to drink coffee at night."
      }
    ]
  },
  {
    "id": "day-07",
    "level": "B2",
    "title": "Поменять привычку",
    "text": "I had been putting off sorting through my old things for months. Once I finally got around to it, I realised how much space I could free up without giving away anything I actually needed.",
    "translation": "Я месяцами откладывал разбор старых вещей. Когда руки наконец дошли, я понял, сколько места можно освободить, не отдавая ничего действительно нужного.",
    "phrases": [
      {
        "id": "day-got-around-to-it",
        "text": "got around to it",
        "meaning": "наконец дошли руки до этого",
        "note": "Get around to something — найти время на отложенное дело. Если дальше глагол, нужна форма -ing: get around to cleaning.",
        "example": "I finally got around to fixing that shelf."
      }
    ]
  },
  {
    "id": "day-08",
    "level": "C1",
    "title": "Границы доступности",
    "text": "Much as I appreciate being able to work from anywhere, I have come to resent the assumption that being reachable amounts to being available, regardless of the hour.",
    "translation": "Как бы я ни ценил возможность работать откуда угодно, меня всё больше раздражает убеждение, будто возможность связаться со мной означает мою готовность работать в любое время суток.",
    "phrases": [
      {
        "id": "day-much-as",
        "text": "Much as I appreciate",
        "meaning": "как бы высоко я ни ценил",
        "note": "Much as + подлежащее + глагол — уступительная конструкция: although I greatly appreciate. Признаёт достоинство перед возражением.",
        "example": "Much as I enjoy company, I sometimes need an evening alone."
      }
    ]
  },
  {
    "id": "day-09",
    "level": "C2",
    "title": "Иллюзия продуктивности",
    "text": "The relentless pursuit of efficiency can be self-defeating: in paring away every supposedly idle moment, we risk forfeiting the unstructured time in which worthwhile ideas take shape.",
    "translation": "Неустанная погоня за эффективностью может обернуться против нас: убирая каждую якобы праздную минуту, мы рискуем лишиться свободного времени, в котором обретают форму стоящие идеи.",
    "phrases": [
      {
        "id": "day-take-shape",
        "text": "take shape",
        "meaning": "обретать форму, постепенно складываться",
        "note": "О замысле, плане или понимании, которое постепенно становится определённым. Выражение не ограничивается физической формой.",
        "example": "The idea began to take shape during an aimless afternoon walk."
      }
    ]
  },
  {
    "id": "day-10",
    "level": "B1",
    "title": "Неожиданная замена планов",
    "text": "Something came up at the last minute, so I had to cancel dinner. I will make it up to you next week.",
    "translation": "В последнюю минуту всплыло срочное дело, так что мне пришлось отменить ужин. Я заглажу вину на следующей неделе.",
    "phrases": [
      {
        "id": "day-came-up",
        "text": "came up",
        "meaning": "неожиданно возникло",
        "note": "Something came up — появилось непредвиденное обстоятельство, обычно мешающее планам. Не путайте с come up with — придумать.",
        "example": "Sorry I missed the call. Something came up at work."
      },
      {
        "id": "day-make-it-up-to-you",
        "text": "make it up to you",
        "meaning": "загладить вину перед тобой",
        "note": "Make it up to someone — компенсировать разочарование или причинённые неудобства. Это не make up в значении выдумывать.",
        "example": "Let me make it up to you with lunch on Friday."
      }
    ]
  },
  {
    "id": "day-11",
    "level": "B1",
    "title": "Неважно себя чувствовать",
    "text": "I have been feeling under the weather since yesterday, so I will stay in and rest instead of going to the shops.",
    "translation": "Со вчерашнего дня я чувствую себя неважно, поэтому останусь дома и отдохну вместо похода по магазинам.",
    "phrases": [
      {
        "id": "day-under-the-weather",
        "text": "under the weather",
        "meaning": "неважно себя чувствовать",
        "note": "Мягкий способ сказать, что вы приболели или чувствуете себя плохо, без описания симптомов.",
        "example": "She stayed home because she was feeling under the weather."
      },
      {
        "id": "day-stay-in",
        "text": "stay in",
        "meaning": "остаться дома",
        "note": "Stay in противопоставляется go out. Stay in tonight — провести вечер дома, а не в городе.",
        "example": "We decided to stay in and cook rather than eat out."
      }
    ]
  },
  {
    "id": "day-12",
    "level": "B1",
    "title": "По делам",
    "text": "I need to run a few errands before lunch: pick up the dry cleaning, drop off a parcel, and stock up on groceries.",
    "translation": "Мне нужно сделать несколько дел до обеда: забрать вещи из химчистки, отправить посылку и закупиться продуктами.",
    "phrases": [
      {
        "id": "day-run-a-few-errands",
        "text": "run a few errands",
        "meaning": "сделать несколько мелких дел",
        "note": "Errands — короткие практические поручения в городе: банк, почта, магазин. Run errands — стандартное сочетание.",
        "example": "I will run a few errands and then come over."
      },
      {
        "id": "day-stock-up-on",
        "text": "stock up on",
        "meaning": "закупиться впрок",